2436,"He's a man of incredible strength\nand resolve...but he's in the\ntower somewhere, and nobody knows\nif he's even still alive anymore.","那家伙不论功夫还是胆识\n都是难得一见的好人材。\n可惜现在已经不在这里了...","腕っぷしも、きっぷも\n稀に見るような奴だったが\n今は、もうここにはいねぇんだ……。",
2438,"Don't tell me a weakling like\nyou is headed into the tower...\nMan, I had no idea Boss Goban\nwas so cruel!","没想到老大会让你这样的小鬼\n进去达姆之塔...\n真不知道他心里在想什么。","まさか、お前みてぇなガキを\nダームの塔に入れるとはな……\nまったく、お頭の気が知れねぇよ。",
2439,"Listen, if things get crazy\nin there, head out to one of\nthe balconies. The monsters\nalmost always stay indoors.","知道吗，危急时就逃到外面的走廊。\n魔物一般是不会再追上来的。","いいか、危なくなったら外の回廊へ逃げろ。\n魔物が追ってくることは滅多にないはずだ。",
2440,"And keep a close eye on your\nstatus. Never forget, if you\ndrop your guard for just one\nmoment, it could be your last!","还有，要随时注意自己携带的物品。\n一时的疏忽可能造成自己的死亡。记住了吗！","それと、持ち物には常に気をつけておけ。\n一瞬のミスが、死につながるのを忘れるな！",
2441,"There are two stone pedestals.\nIt looks like they were meant\nto hold statues.","有两个石造的台座。\n好像是用来摆放什么雕像的。","石造りの台座が二つある。\nどうやら何かの像を乗せていたようだ。",
2444,"Are you sure about this?\nIf they're available, the\nmilitia will gladly escort\nyou back to Zepik Village.","...这样真的好吗？\n自卫队的人说等他们一有空\n马上就护送你去塞皮克村。","……本当にいいのかね？\n自警団の連中も、手が空いたら\nゼピック村まで護衛すると言っておる。",
2445,"No need to worry... I can\nmake it back on my own.","请别担心。\n我一个人就可以回去了。","御心配には及びません。\nなんとか一人でも帰れますよ。",
2446,"First and foremost, I need\nto go and comfort my wife!","我想及早\n让我妻子放心...。","早いところ、\n妻を安心させてやりたいですし……。",
